Top Stories	Article	Publication	Reliability Range (Interactive MB)	Bias Range (Interactive MB)	Audience (Interactive MB)	MB/FC Slant	Rank Number	Date Recorded	Within 24 hours?		Factual Reporting		(probably not needed)
Voting bills advance in Texas Legislature after overnight committe hearings	https://www.texastribune.org/2021/07/10/voting-bill-texas/	The Texas Tribune	45.9	-4.27		Left-Center	1	July 11, 2021			High		
What Virgin Galactic's milestone flight means for the future of tourists in space	https://www.nationalgeographic.com/science/article/what-virgin-galactic-milestone-flight-means-for-the-future-of-tourists-in-space	National Geographic	46.11	-2.58		Pro-Science	2	July 11, 2021			High		
It's two steps forward, 10 steps back:' Brexit, shifting demographics and familiar tensions stoke divisions in Northern Ireland	https://www.cnn.com/2021/07/11/uk/belfast-northern-ireland-tensions-intl-gbr-cmd/index.html	CNN	43.77	-8.78	79,900,000	Left	3	July 11, 2021			Mixed		
Italy beat England in shootout to win 2020 European Championship	https://www.espn.com/soccer/report/_/gameId/560294	ESPN				Left-Center	4	July 11, 2021			High		
Heat wave keeps baking West after all-time high in Las Vegas on Saturday	https://www.washingtonpost.com/weather/2021/07/11/heat-wave-west-las-vegas/	The Washington Post	44.05	-7.42	76,195,000	Left-Center	5	July 11, 2021			Mostly Factual		
Death toll rises to 90 in Surfside condominium collapse. New victims include 3 children	https://www.miamiherald.com/news/local/community/miami-dade/miami-beach/article252711353.html	Miami Herald	46.7	-3.86		Left-Center	6	July 11, 2021			High		
They will never let go': Isis fighters regroup in the heart of Iraq	https://www.theguardian.com/world/2021/jul/11/isis-fighters-regroup-in-the-heart-of-iraq	The Guardian	44.42	-9.93	88,750,000	Left-Center	7	July 11, 2021			Mixed		
Fencing around U.S. Capitol removed six months after deadly Jan. 6 attack	https://www.reuters.com/world/us/fencing-around-us-capitol-removed-six-months-after-deadly-jan-6-attack-2021-07-11/	REUTERS	49.3	-1.65	40,574,000	Neutral	8	July 11, 2021			Very High		
Richard Branson's Virgin Galactic Flight Opens Door to Space Tourism	https://www.reuters.com/lifestyle/science/virgin-galactics-branson-ready-space-launch-aboard-rocket-plane-2021-07-11/	REUTERS	49.3	-1.65	40,574,000	Neutral	9	July 11, 2021			Mostly Factual		
Novak Djokovic wins Wimbledon to claim record-tying 20th Grand Slam victory	https://www.espn.com/tennis/story/_/id/31800532/novak-djokovic-wins-wimbledon-claim-record-tying-20th-grand-slam-victory	ESPN				Left-Center	10	July 11, 2021			High		
Novak Djokovic wins 20th Grand Slam at Wimbledon, ties men's all-time record	https://www.usatoday.com/story/sports/tennis/wimb/2021/07/11/wimbledon-novak-djokovic-wins-20th-grand-slam/7929828002/	USA Today	45.77	-4.12	44,075,000	Left-Center	11	July 11, 2021			High		
2 firefighters killed as Western wildfires intensify in heat wave	https://www.nbcnews.com/news/us-news/serious-situation-western-heat-wave-wildfires-threaten-california-power-grid-n1273635	NBC News	45.81	-7.46	26,225,000	Left-Center	12	July 11, 2021			High		
Haitians hope 'the truth will come out' as foreign investigators probe assassination of their  President	https://www.cnn.com/2021/07/11/americas/haiti-assassination-investigation-intl-cmd/index.html	CNN	43.77	-8.78	79,900,000	Left	13	July 11, 2021			Mixed		
Illinois Has a Program to Compensate Victims of Violent Crimes. Few Applicants Receive Funds.	https://www.thetrace.org/2021/07/illinois-violent-crime-victim-compensation-application-data/	The TRACE				Left-Center	14	July 11, 2021			High		
Florida condo collapse spurs many cities to action - but some worry residents will  resist	https://www.usatoday.com/restricted/?return=https%3A%2F%2Fwww.usatoday.com%2Fstory%2Fnews%2F2021%2F07%2F11%2Fflorida-condo-collapse-residents-heed-call-more-inspections%2F7905223002%2F	USA Today	45.77	-4.12	44,075,000	Left-Center	15	July 11, 2021			High		
Heat wave hit Northwest business from Christmas trees and doughnuts to fish	https://www.wsj.com/articles/heat-wave-hit-northwest-businesses-from-christmas-trees-and-doughnuts-to-fish-11625995801	The Wall Street Journal	46.32	4.92	39,430,000	Right-Center	16	July 11, 2021			Mostly Factual		
In Haiti, rivals claw for power as crisis escalates after assassination	https://www.washingtonpost.com/world/the_americas/haiti-assassination-biden-moise-power/2021/07/10/2abf4670-e186-11eb-a27f-8b294930e95b_story.html	The Washington Post	44.05	-7.42	76,195,000	Left-Center	17	July 11, 2021			Mostly Factual		
Branson and Virgin Galactic complete successful space flight	https://www.cbsnews.com/news/richard-branson-virgin-galactic-space-launch/	CBS News	48.04	-3.14	24,400,000	Left-Center	18	July 11, 2021			High		
Ethiopia PM Abiy's party wins lanslide victory in election	https://www.reuters.com/world/africa/ethiopia-pm-abiys-party-wins-landslide-victory-parliamentary-election-2021-07-10/	REUTERS	49.3	-1.65	40,574,000	Neutral	19	July 11, 2021			Very High		
Heat Wave Killed An Estimated 1 Billion Sea Creatures, And Scientists Fear Even Worse	https://www.npr.org/2021/07/09/1014564664/billion-sea-creatures-mussels-dead-canada-british-columbia-vancouver	NPR	46.41	-5.24	38,240,000	Left-Center	20	July 11, 2021			Very High		
Soaring temps approaching all-time world record in the Southwest this weekend	https://www.accuweather.com/en/weather-forecasts/western-us-heat-wave-death-valley-las-vegas/978996	AccuWeather				N/A	21	July 11, 2021			N/A		
Florida condo collapse sparks calls for tighter laws	https://www.wsj.com/articles/miami-area-condo-collapse-sparks-calls-for-tighter-laws-11625922002	The Wall Street Journal	46.32	4.92	39,430,000	Right-Center	22	July 11, 2021			Mostly Factual		
With an uptick in Covid-19 cases, there is growing alarm. 'We've seen almost an entire takeover in the Delta variant,' one state official says	https://www.cnn.com/2021/07/10/health/us-coronavirus-saturday/index.html	CNN	43.77	-8.78	79,900,000	Left	23	July 11, 2021			Mixed		
In California's interior, there's no escapre from the desperate heat: "Why are we even here?"	https://www.theguardian.com/us-news/2021/jul/10/california-central-valley-extreme-heat-race	The Guardian	44.42	-9.93	88,750,000	Left-Center	24	July 11, 2021			Mixed		
Who killed Haiti's president? Plot thickens as Moise's guards come under scrutiny	https://www.latimes.com/world-nation/story/2021-07-10/haiti-president-assasinated	Los Angeles Times				Left-Center	25	July 11, 2021			High		
How Indigenous leaders are pushing to vaccinate their hard-hit communities	https://www.nationalgeographic.com/culture/article/covid19-and-indigenous-communities	National Geographic	46.11	-2.58		Pro-Science	26	July 11, 2021			High		
Death toll reaches 86 in Surfside collapse. Site to be cleared 'sooner than expected'	https://www.miamiherald.com/news/local/community/miami-dade/miami-beach/article252697918.html	Miami Herald	46.7	-3.86		Left-Center	27	July 11, 2021			High		
One counselor, 665 students: Counselors stretched at Chicago's majority Latino schools	https://chicago.chalkbeat.org/2021/7/8/22566906/one-counselor-665-students-counselors-stretched-at-chicagos-majority-latino-schools	Chalkbeat				N/A	28	July 11, 2021			N/A		
Branson flight signals confidence in commercial spaceflight	https://www.washingtonpost.com/business/2021/07/09/rent-prices-rising/	CBS News	48.04	-3.14	24,400,000	Left-Center	29	July 11, 2021			High		
Rent prices are soaring as Americans flock back to cities	https://www.washingtonpost.com/business/2021/07/09/rent-prices-rising/	The Washington Post	44.05	-7.42	76,195,000	Left-Center	30	July 11, 2021			Mostly Factual		
Third statue comes down in Charlottesville	https://www.nbcnews.com/news/us-news/robert-e-lee-statue-removed-charlottesville-n1273612	NBC News	45.81	-7.46	26,225,000	Left-Center	31	July 11, 2021			High		
Western states face possible all-time heat records this weekend	https://www.cnn.com/2021/07/10/weather/heat-records-weekend-rolling-blackouts-california/index.html	CNN	43.77	-8.78	79,900,000	Left	32	July 11, 2021			Mixed		
Charlottesville Removes Robert E. Lee Statue That Sparked A Deadly Rally	https://www.npr.org/2021/07/10/1014926659/charlottesville-removes-robert-e-lee-statue-that-sparked-a-deadly-rally	NPR	46.41	-5.24	38,240,000	Left-Center	33	July 11, 2021			Very High		
Cat that lived in collapsed Surfside condo tower is found safe, reunited with family	https://www.miamiherald.com/news/local/community/miami-dade/miami-beach/article252676183.html	Miami Herald	46.7	-3.86		Left-Center	34	July 11, 2021			High		
Biden's bid to take on big business sets off battle over who holds power in U.S. economy	https://www.seattletimes.com/nation-world/biden-taking-aim-at-big-business-in-sweeping-executive-order-to-boost-competition/	The Washington Post	44.05	-7.42	76,195,000	Left-Center	35	July 11, 2021			Mostly Factual		
Scorching weekend heat expected to hit 30+ million people in West with temps up to 130 degrees	https://www.usatoday.com/story/news/nation/2021/07/09/weekend-heat-forecast-west-las-vegas-record-could-broken/7918244002/	USA Today	45.77	-4.12	44,075,000	Left-Center	36	July 11, 2021			High		
Lawyers for Breonna Taylor's family sue police over existence of body camera footage	https://abcnews.go.com/US/lawyers-breonna-taylors-family-sue-police-existence-body/story?id=78753109#:~:text=LOG%20IN-,Lawyers%20for%20Breonna%20Taylor's%20family%20sue%20police%20over%20existence%20of,%2C%22%20said%20attorney%20Sam%20Aguiar.&text=%22Breonna's%20family%20has%20a%20right%20to%20the%20records%2C%22%20Taylor,a%20right%20to%20the%20records.%22	ABC News	47.28	-4.9	39,500,000	Left-Center	37	July 11, 2021			High		
We live in a desert. We have to act like it': Las Vegas faces reality of drought	https://www.theguardian.com/us-news/2021/jul/09/las-vegas-climate-change-drought-water-conservation	The Guardian	44.42	-9.93	88,750,000	Left-Center	38	July 11, 2021			Mixed		
A third of Wisconsin's wolves killed after losing protections this year, study says	https://www.nationalgeographic.com/animals/article/wisconsin-wolf-hunt-killed-one-third-state-population	National Geographic	46.11	-2.58		Pro-Science	39	July 11, 2021			High		
Where Are The Newest COVID Hot Spots? Mostly Places With Low Vaccination Rates	https://www.npr.org/sections/health-shots/2021/07/09/1014512213/covid-is-surging-in-new-hotspots-driven-by-low-vaccination-rates	NPR	46.41	-5.24	38,240,000	Left-Center	40	July 11, 2021			Very High		
Why were Colombian ex-soldiers in Haiti? Experts say they are popular mercenaries	https://www.reuters.com/world/americas/why-were-colombian-ex-soldiers-haiti-experts-say-they-are-popular-mercenaries-2021-07-09/	REUTERS	49.3	-1.65	40,574,000	Neutral	41	July 11, 2021			Very High		
U.S rebuffs Haiti troops request after president's assassination	https://www.reuters.com/world/americas/colombian-suspects-haiti-presidents-killing-arrived-via-dominican-republic-2021-07-09/	REUTERS	49.3	-1.65	40,574,000	Neutral	42	July 11, 2021			Very High		
Smaller cities jump in hot housing market	https://www.nbcnews.com/business/real-estate/where-do-you-move-after-selling-hot-market-smaller-city-n1273465	NBC News	45.81	-7.46	26,225,000	Left-Center	43	July 11, 2021			High		
Biden Targets Big Business in Sweeping Executive Order to Spur Competition	https://www.wsj.com/articles/biden-takes-aim-at-corporate-consolidation-big-business-tactics-11625832017	The Wall Street Journal	46.32	4.92	39,430,000	Right-Center	44	July 11, 2021			Mostly Factual		
Biden fires head of Social Security Administration, a Trump holdover who drew the ire of Democrats	https://www.washingtonpost.com/politics/andrew-saul-social-security-/2021/07/09/c18a34fa-df99-11eb-a501-0e69b5d012e5_story.html	The Washington Post	44.05	-7.42	76,195,000	Left-Center	45	July 11, 2021			Mostly Factual		
Biden nominates L.A. Mayor Eric Garcetti as U.S. ambassador to India	https://timesofindia.indiatimes.com/world/us/biden-nominates-los-angeles-mayor-garcetti-as-us-ambassador-to-india/articleshow/84280282.cms	Los Angeles Times				Left-Center	46	July 11, 2021			High		
Death toll rises to 79 as more scientists examine cause of Surfside condo collapse	https://www.miamiherald.com/news/local/community/miami-dade/miami-beach/article252673583.html	Miami Herald	46.7	-3.86		Left-Center	47	July 11, 2021			High		
Missouri becomes group zero for COVID-19 battle	https://thehill.com/homenews/state-watch/562313-missouri-becomes-ground-zero-for-covid-19-battle	The Hill	44.99	-0.38	24,400,000	Neutral	48	July 11, 2021			Mostly Factual		
More Abortion Restrictions Have Been Enacted In The U.S. This Year Than In Any Other	https://www.npr.org/2021/07/09/1014475875/abortion-rights-laws-states-record-conservatives	NPR	46.41	-5.24	38,240,000	Left-Center	49	July 11, 2021			Very High		
Biden delivers a warning to Putin over ransomware attacks	https://www.politico.com/news/2021/07/09/biden-putin-ransomware-attack-498956	POLITICO	43.35	-7.19	23,750,000	Left-Center	50	July 11, 2021			High		
													
State democrats announce plans for $3.5 trillion budget package to expand Medicare, advance Biden priorities	https://www.washingtonpost.com/us-policy/2021/07/13/infrastructure-senate-white-house/	The Washington Post	44.05	-7.42	76,195,000	Left-Center	1	July 13, 2021	TRUE		Mostly Factual		
"This is a test of our time," Biden says about voting rights	https://www.npr.org/2021/07/13/1015621049/texas-democrats-biden-voting-rights	NPR	46.41	-5.24	38,240,000	Left-Center	2	July 13, 2021	TRUE		Very High		
After vaccination burnout, delta variant spurs countries to speed up shots	https://www.reuters.com/business/healthcare-pharmaceuticals/after-vaccination-burnout-delta-variant-spurs-countries-speed-up-shots-2021-07-13/	Reuters	49.3	-1.65	40,574,000	Neutral	3	July 13, 2021	TRUE		High		
more than 70 killed in South Africa protests after former leader Jacob Zuma	https://www.cnn.com/2021/07/13/africa/south-africa-violence-protests-intl/index.html	CNN	43.77	-8.78	79,900,000	Left	4	July 13, 2021	TRUE		Mixed		
American league rolls to eight straight all-star game win, vladamir guerrero wins MVP	https://sports.yahoo.com/mlb-all-star-game-denver-american-league-wins-mvp-032028478.html	Yahoo Sports	42.71	-6.6		Left-Center	5	July 13, 2021	TRUE		Mixed		
the engineer who turned an xbox cheat into bitcoin millions	https://www.bloomberg.com/features/2021-microsoft-xbox-gift-card-fraud/	Bloomberg Businessweek				Left-Center	6	July 13, 2021	TRUE		Mostly Factual		
Senate democrats agree to $3.5 trillion tax, spending plan	https://www.bloomberg.com/news/articles/2021-07-14/senate-democrats-agree-to-3-5-trillion-tax-spending-bill	Bloomberg	45.76	-3.04	26,673,500	Left-Center	7	July 13, 2021	TRUE		Mostly Factual		
Biden calls passing voting legislation 'a national imperative' and castigates voting restrictions	https://www.washingtonpost.com/politics/biden-voting-speech/2021/07/13/afd91f7a-e3d9-11eb-8aa5-5662858b696e_story.html	the Washington Post	44.05	-7.42	76,195,000	Left-Center	8	July 13, 2021	TRUE		Mostly Factual		
Wildfires rage across parched wester US as smoke chokes the sky	https://www.accuweather.com/en/weather-forecasts/wildfires-burn-across-western-us-heat-wave/980304	AccuWeather				Unknown	9	July 13, 2021	TRUE		Unknown		
Texas senate passes GOP voting, bail bills despite House Democrats' walkout	https://www.texastribune.org/2021/07/13/voting-bill-texas-senate/	The Texas Tribune	45.9	-4.27		Left-Center	10	July 13, 2021	TRUE		High		
Cuba protests: one man killed and more than 100 missing in historic unrest	https://www.theguardian.com/world/2021/jul/13/cuba-protests-activists-journalists-protesters-detained	The Guardian	44.42	-9.93	88,750,000	Left-Center	11	July 13, 2021	TRUE		Mixed		
Senate democrats agree to $3.5 trillion healthcare and antipoverty plan	https://www.wsj.com/articles/infrastructure-deals-revenue-hopes-raise-gop-concerns-11626216975	The Wall Street Journal	46.32	4.92	39,430,000	Right-Center	12	July 13, 2021	TRUE		Mostly Factual		
Inflation accelerates again in June as economic recovery continues	https://www.wsj.com/articles/us-inflation-consumer-price-index-june-2021-11626125947	The Wall Street Journal	46.32	4.92	39,430,000	Right-Center	13	July 13, 2021	TRUE		Mostly Factual		
Four Iranians charged with plotting to kidnap author living in Brooklyn	https://www.nbcnews.com/news/us-news/four-iranians-charged-plotting-kidnap-author-living-brooklyn-n1273890	NBC news	45.81	-7.46	26,225,000	Left-Center	14	July 13, 2021	TRUE		High		
COVID cases in parts of missouri and arkansas surge to levels not seen since winter	https://www.npr.org/2021/07/13/1015581093/covid-cases-in-parts-of-missouri-and-arkansas-surge-to-levels-not-seen-since-win	NPR	46.41	-5.24	38,240,000	Left-Center	15	July 13, 2021	TRUE		Very High		
Texas democrats heap pressure on Biden, congress for voting rights action	https://www.cnn.com/2021/07/13/politics/texas-house-democrats-buying-time/index.html	CNN	43.77	-8.78	79,900,000	Left	16	July 13, 2021	TRUE		Mixed		
West on fire, east under water as climate change fuels extremes	https://www.nbcnews.com/news/weather/west-catches-fire-while-east-goes-under-water-climate-change-n1273815	NBC news	45.81	-7.46	26,225,000	Left-Center	17	July 13, 2021	TRUE		High		
Haitians apprehensive of foreign troops as government seeks US help	https://www.reuters.com/world/americas/haitians-apprehensive-foreign-troops-government-seeks-us-help-2021-07-13/	Reuters	49.3	-1.65	40,574,000	Neutral	18	July 13, 2021	TRUE		High		
Texas senate passes voting bill, as democratic rivals push federal bill	https://www.wsj.com/articles/texas-senate-expected-to-take-up-vote-on-election-legislation-11626176054	The Wall Street Journal	46.32	4.92	39,430,000	Right-Center	19	July 13, 2021	TRUE		Mostly Factual		
2021 emmy awards nominations: the crown, ted lasso and wanda vision lead	https://www.yahoo.com/news/2021-emmy-awards-nominations-complete-153017342.html	People				Left	20	July 13, 2021	TRUE		High		
Biden denounces "21st century jim crow assault" on voting access	https://www.cbsnews.com/news/biden-voting-rights-speech-watch-live-today-2021-07-13/	CBS News	48.04	-3.14	24,400,000	Left-Center	21	July 13, 2021	TRUE		High		
Emmys: Disney leads all combined nominations as HBO tops netflix	https://www.hollywoodreporter.com/tv/tv-news/emmy-nominations-by-series-network-2021-1234981275/	Hollywood Reporter				Left-Center	22	July 13, 2021	TRUE		High		
How we'll know when the COVID-19 crisis is over	https://www.npr.org/2021/07/10/1014374383/covid-19-coronavirus-pandemic-when-its-over	NPR	46.41	-5.24	38,240,000	Left-Center	23	July 13, 2021	TRUE		Very High		
"Your evil revolution": how a reggaeton anthem inspired cuba protests	https://www.nationalgeographic.com/history/article/cuba-protests	National Geographic	46.11	-2.58		Pro-Science	24	July 13, 2021	FALSE		High		
Recovery operation moves toward completion at Florida condo collapse, 95 dead	https://www.cnbc.com/2021/07/13/recovery-operation-moves-toward-completion-at-florida-condo-collapse.html	CNBC	45.45	-2.05	27,050,000	Left-Center	25	July 13, 2021	TRUE		Mostly Factual		
Texas governor says Democratic lawmakers who left state to stop voting law could face arrest	https://www.washingtonpost.com/politics/texas-democrats-voting-restrictions/2021/07/12/99d35154-e326-11eb-8aa5-5662858b696e_story.html	The Washington Post	44.05	-7.42	76,195,000	Left-Center	26	July 13, 2021	TRUE		Mostly Factual		
COVID-19 case count spikes hit almost every state	https://thehill.com/policy/healthcare/562628-covid-19-case-count-spikes-hit-almost-every-state	The Hill	44.99	-0.38	24,400,000	Neutral	27	July 13, 2021	FALSE		Mostly Factual		
Bootleg fire, one of dozens raging in the west, creates "firenado" near orgeon-california border	https://www.usatoday.com/story/news/nation/2021/07/13/wildfires-roar-through-west-california-oregon-and-beyond/7947936002/	USA Today				Left-Center	28	July 13, 2021	TRUE		High		
South Africa Zuma riots: deadly unrest rages across country	https://www.bbc.com/news/world-africa-57818215	BBC News	46.44	-2.74	189,750,000	Left-Center	29	July 13, 2021	TRUE		High		
Customers are back at restaurants and bard, but workers have moved on	https://www.wsj.com/articles/customers-are-back-at-restaurants-and-bars-but-workers-have-moved-on-11626168601	The Wall Street Journal				Right-Center	30	July 13, 2021	TRUE		Mostly Factual		
													
Biden rallies support on Capitol Hill for sweeping spending deal	https://www.nbcnews.com/politics/congress/biden-heads-capitol-promote-infrastructure-deal-n1273907	NBC News	45.81	-7.46	26,225,000	Left-Center	1	July 14, 2021	TRUE				
Historians Identify 14 Living Relatives of Leonardo da Vinci	https://www.smithsonianmag.com/smart-news/da-vinci-relatives-dna-testing-genome-180978153/	Smithsonian				Pro-Science	2	July 14, 2021	FALSE				
Britney Spears granted right to hire own lawyer; accuses father of 'conservatorship abuse'	https://www.nbcnews.com/pop-culture/pop-culture-news/britney-spears-wants-choose-her-own-attorney-she-may-find-n1273876	NBC News	45.81	-7.46	26,225,000	Left-Center	3	July 14, 2021	TRUE				
Cuba's Internet comes back on - and reveals scenes of a crackdown	https://www.washingtonpost.com/world/2021/07/14/cuba-protests-internet/	The Washington Post	44.05	-7.42	76,195,000	Left-Center	4	July 14, 2021	TRUE				
Wildfires spread across almost 1M miles of drought-stricken US	https://www.foxnews.com/us/wildfires-spread-million-acres-drought-us	Fox News				Right	5	July 14, 2021	TRUE				
What's in Democrats' $3.5 trillion budget plan - and how they plan to pay for it	https://www.wsj.com/articles/democrats-budget-plan-what-11626301275	The Wall Street Journal	46.32	4.92	39,430,000	Right-Center	6	July 14, 2021	TRUE				
Delta variant gains ground in U.S. as outbreaks highlight vaccine divide	https://www.theguardian.com/us-news/2021/jul/14/us-delta-variant-coronavirus-covid-vaccine-divide	The Guardian	44.42	-9.93	88,750,000	Left-Center	7	July 14, 2021	TRUE				
EU, China Unveils Sweeping Plans to Cut Greenhouse-Gas Emissions	https://www.wsj.com/articles/eu-to-propose-sweeping-economic-plan-to-combat-climate-change-11626251377	The Wall Street Journal	46.32	4.92	39,430,000	Right-Center	8	July 14, 2021	TRUE				
FBI made serious errors during sex abuse investigation of Larry Nassar, Justice Department says	https://www.latimes.com/politics/story/2021-07-14/justice-department-inspector-general-nassar-investigation	Los Angeles Times				Left-Center	9	July 14, 2021	TRUE				
Red State, Blue State, Twin Outbreak: Behind Wyoming and Colorado's Anomalous Covid Spikes	https://khn.org/news/article/red-state-blue-state-twin-outbreak-behind-wyoming-and-colorados-anomalous-covid-spikes/	Kaiser Health News				Unknown	10	July 14, 2021	TRUE				
Britney Spears Gets Court Approval to Hire Her Chosen Attorney in Conservatorship Battle	https://www.hollywoodreporter.com/news/general-news/britney-spears-conservatorship-battle-1234981839/	Hollywood Reporter				Left-Center	11	July 14, 2021	TRUE				
European Commision proposes ambitious climate change policies, urging U.S. and other nations to follow	https://www.washingtonpost.com/world/europe-climate-plan/2021/07/14/197ced78-e49b-11eb-88c5-4fd6382c47cb_story.html	The Washington Post	44.05	-7.42	76,195,000	Left-Center	12	July 14, 2021	TRUE				
Absolutely chilling': Larry Nassar sex abuse reports met with massive FBI failures, DOJ watchdog says	https://www.usatoday.com/story/news/politics/2021/07/14/larry-nassar-investigation-included-appalling-failures-fbi-admits/7971033002/	USA Today	45.77	-4.12	44,075,000	Left-Center	13	July 14, 2021	TRUE				
Passport Delays to Persist, State Department Says, Even With More Staffing	https://www.wsj.com/articles/passport-delays-to-persist-state-department-says-even-with-more-staffing-11626296173	The Wall Street Journal				Right-Center	14	July 14, 2021	TRUE				
Biden urges Democratic unity on rebuilding infrastructure, expanding social programs	https://www.latimes.com/politics/story/2021-07-14/senate-infrastructure-latest	Los Angeles Times				Left-Center	15	July 14, 2021	TRUE				
Miami-Dade judge approves pursuing sale of Surfside property that is site of condo collapse	https://www.miamiherald.com/news/local/crime/article252754113.html	Miami Herald	46.7	-3.86		Left-Center	16	July 14, 2021	TRUE				
Brace for flooding. A moon 'wobble' is coming, NASA warns	https://www.usatoday.com/story/news/weather/2021/07/13/moons-wobble-cause-record-number-flood-nasa/7958703002/	USA Today	45.77	-4.12	44,075,000	Left-Center	17	July 14, 2021	TRUE				
Health costs of gun violence exceeds $1 billion a year, GAO says	https://www.politico.com/news/2021/07/14/gun-violence-health-costs-499615	POLITICO	43.35	-7.19	23,750,000	Left-Center	18	July 14, 2021	TRUE				
We are seeing people passing quicker than before': What hospitals look like in US Covid hot spots	https://www.cnn.com/2021/07/13/us/us-covid-hot-spots-hospitals/index.html	CNN	43.77	-8.78	79,900,000	Left	19	July 14, 2021	TRUE				
More People Than Ever Died Of Drug Overdoses In The US In 2020	https://www.buzzfeednews.com/article/danvergano/overdose-deaths-record-2020	BuzzFeed News				Left-Center	20	July 14, 2021	TRUE				
US to evacuate Afghans who assisted US military	https://thehill.com/policy/defense/562953-us-to-evacuate-afghans-who-assisted-us-military	The Hill	44.99	-0.38	24,400,000	Neutral	21	July 14, 2021	TRUE				
In Cuba, Covid-19 Stress Pushes Unrest to the Edge	https://www.wsj.com/articles/in-cuba-covid-19-stress-pushes-unrest-to-the-edge-11626268720	The Wall Street Journal	46.32	4.92	39,430,000	Right-Center	22	July 14, 2021	TRUE				
Items found in Surfside rubble could bring legal challenges upon trying to return them	https://www.yahoo.com/lifestyle/possessions-found-surfside-collapse-reveal-083735803.html	NBC News	45.81	-7.46	26,225,000	Left-Center	23	July 14, 2021	TRUE				
