Twin cheerleading stars sexually abused by coach at Frisco, Plano gyms, lawsuit says	https://news.yahoo.com/twin-cheerleading-stars-sexually-abused-193810710.html?fr=sycsrp_catchall	Fort Worth Star-Telegram				Right-Center	30.0	July 19, 2021	True	0.606964
										ERROR
Texas hospital reports its 1st case of lambda COVID-19 variant	https://news.yahoo.com/johnson-johnson-vaccine-may-less-080034738.html?fr=sycsrp_catchall	ABC News				Left-Center	1.0	July 20, 2021	True	-0.706923
Patients are warned that IUDs can be 'uncomfortable.' But many say the pain is excruciating.	https://news.yahoo.com/patients-warned-iuds-uncomfortable-many-191236192.html?fr=sycsrp_catchall	Washington Post				Left-Center	2.0	July 20, 2021	False	-4.261717
Mask mandates make a return - along with controversy	https://news.yahoo.com/world-first-booster-jab-rollout-190235469.html?fr=sycsrp_catchall	Washington Post				Left-Center	3.0	July 20, 2021	False	2.79528
Nearly 120,000 children in US have lost a primary caregiver to COVID-19: Internal CDC data	https://www.yahoo.com/gma/nearly-120-000-children-us-100606407.html	Good Morning America				Left-Center	4.0	July 20, 2021	True	-0.917157
To China, Trump Was Bad. Biden Seems Even Worse.	https://news.yahoo.com/china-trump-bad-biden-seems-184214655.html	The New York Times				Left-Center	5.0	July 20, 2021	True	-8.522924
Key question for Americans overseas: Can their phones be hacked?	https://news.yahoo.com/key-americans-overseas-phones-hacked-024401058.html?fr=sycsrp_catchall	Washington Post				Left-Center	6.0	July 20, 2021	False	-1.818016
Singapore shocked by killing of boy, 13, at school	https://news.yahoo.com/singapore-murder-schoolboy-charged-over-044846613.html?fr=sycsrp_catchall	BBC				Left-Center	7.0	July 20, 2021	True	-3.613133
Teen with US ties again on the run from China with fiancee	https://news.yahoo.com/teen-us-ties-again-run-040429713.html?fr=sycsrp_catchall	Associated Press				Neutral	8.0	July 20, 2021	True	-3.209333
U.S., Japan, South Korea send clear message to N.Korea - U.S. diplomat	https://news.yahoo.com/u-japan-south-korea-send-043026971.html?fr=sycsrp_catchall	Reuters				Neutral	9.0	July 20, 2021	True	0.285829
Minister accused of giving teen meth and raping her at church, Texas police say	https://news.yahoo.com/minister-accused-giving-teen-meth-224116318.html?fr=sycsrp_catchall	Fort Worth Star-Telegram				Right-Center	10.0	July 20, 2021	True	2.853586
Why Tom Brady's 'gentle' roast of Trump at Biden's White House was actually 'deeply vicious'	https://news.yahoo.com/why-tom-bradys-gentle-roast-063040323.html?fr=sycsrp_catchall	The Week				Left	11.0	July 20, 2021	True	-20.856276
Japanese envoy says Tokyo 'struggles every day' with China	https://news.yahoo.com/japanese-envoy-says-tokyo-struggles-051708063.html?fr=sycsrp_catchall	Associated Press				Neutral	12.0	July 20, 2021	True	0.311455
Push to get wary Russians vaccinated leaves some COVID clinics short	https://news.yahoo.com/push-wary-russians-vaccinated-leaves-061122305.html?fr=sycsrp_catchall	Reuters				Neutral	13.0	July 20, 2021	True	-0.258485
DEA agent charged in Capitol riot after his friend told the FBI he lied about his participation to 'cover his a--'	https://news.yahoo.com/dea-agent-charged-capitol-riot-195240561.html?fr=sycsrp_catchall	INSIDER				Left-Center	14.0	July 20, 2021	True	-3.879738
New study suggests J recipients should get booster shot to protect against Delta variant	https://news.yahoo.com/study-suggests-j-recipients-booster-212500819.html?fr=sycsrp_catchall	The Week				Left	15.0	July 20, 2021	True	-5.408594
Biden's 3rd trip to reddish Ohio pushes his economic agenda	https://www.aol.com/biden-3rd-trip-reddish-ohio-123412245.html	Associated Press				Neutral	16.0	July 20, 2021	True	ERROR
Guantánamo Bay inmate sent to home country in Biden policy shift	https://news.yahoo.com/guant-namo-bay-inmate-sent-153925759.html	Yahoo News Video				Questionable Source	17.0	July 20, 2021	False	-1.683224
Covid-19: India outrage over 'no oxygen shortage death data' claim	https://news.yahoo.com/covid-19-india-outrage-over-064449882.html?fr=sycsrp_catchall	BBC				Left-Center	18.0	July 20, 2021	False	-4.557521
Hong Kong police arrest former Apple Daily senior editor	https://news.yahoo.com/hong-kong-police-arrest-former-043841505.html?fr=sycsrp_catchall	Associated Press				Neutral	19.0	July 20, 2021	True	-0.843894
11 Products to Satisfy an Obsession With Sage Green	https://news.yahoo.com/11-products-satisfy-obsession-sage-181856494.html	Architectural Digest				Left	20.0	July 20, 2021	True	-0.281024
Rep. Priscilla Giddings faces House ethics hearing, complaints of ‘conduct unbecoming’	https://news.yahoo.com/rep-priscilla-giddings-faces-house-205733698.html?fr=sycsrp_catchall	Idaho Statesman				Neutral	21.0	July 20, 2021	True	-3.995413
Vaccinated people can still get COVID. Here are the most common symptoms, study says	https://news.yahoo.com/cdc-covid-19-outbreak-among-170000960.html?fr=sycsrp_catchall	Miami Herald				Left-Center	22.0	July 20, 2021	True	-1.302519
Mandira Bedi: What Hindu scriptures say about women at cremations	https://news.yahoo.com/mandira-bedi-actress-stirs-debate-230108005.html?fr=sycsrp_catchall	BBC				Left-Center	23.0	July 20, 2021	False	-8.062603
50-year war on drugs imprisoned millions of Black Americans	https://news.yahoo.com/50-war-drugs-imprisoned-millions-054201210.html?fr=sycsrp_catchall	Associated Press				Neutral	24.0	July 20, 2021	True	-8.490052
Covid: The Mexican villages refusing to vaccinate	https://news.yahoo.com/covid-mexican-villages-refusing-vaccinate-230752812.html?fr=sycsrp_catchall	BBC				Left-Center	25.0	July 20, 2021	False	-6.518661
Here’s why Florida is seeing a surge of COVID cases again — and how to protect yourself	https://news.yahoo.com/florida-leads-nation-kids-hospitalized-223800797.html?fr=sycsrp_catchall	Miami Herald				Left-Center	26.0	July 20, 2021	True	-3.855865
An Australian couple was convicted of enslaving an Indian grandmother for 8 years	https://news.yahoo.com/australian-couple-convicted-enslaving-indian-063322313.html?fr=sycsrp_catchall	INSIDER				Left-Center	27.0	July 20, 2021	True	-1.825727
Covid: Anger as half of Australians in lockdown again	https://news.yahoo.com/australia-pm-battles-political-survival-095735421.html?fr=sycsrp_catchall	BBC				Left-Center	28.0	July 20, 2021	True	-5.928272
Thomas Barrack told a UAE official that Trump considered appointing him ambassador to the country and 'give Abu Dhabi more power': prosecutors	https://news.yahoo.com/thomas-barrack-told-uae-official-212844991.html?fr=sycsrp_catchall	Business Insider				Left-Center	29.0	July 20, 2021	True	-5.558042
Covid: Ivermectin, milk among Indonesia's unproven 'cures'	https://news.yahoo.com/covid-false-misleading-health-claims-231449421.html?fr=sycsrp_catchall	BBC				Left-Center	30.0	July 20, 2021	True	-5.992595
										ERROR
Johnson & Johnson's vaccine produced fewer antibodies against Delta compared with other shots in an experiment. Experts say we shouldn't worry about the results.	https://news.yahoo.com/johnson-county-election-results-edgerton-022555880.html?fr=sycsrp_catchall	Business Insider				Left-Center	1.0	July 21, 2021	True	-0.878489
Among Mormon Women, Frank Talk About Sacred Underclothes	https://news.yahoo.com/among-mormon-women-frank-talk-121434693.html?fr=sycsrp_catchall	The New York Times				Left-Center	2.0	July 21, 2021	True	-4.526998
Facing criticism for Paralympian's withdrawal, USOPC defends athlete support system	https://news.yahoo.com/facing-criticism-paralympians-withdrawal-usopc-131759064.html?fr=sycsrp_catchall	Washington Post				Left-Center	3.0	July 21, 2021	True	-4.407171
So, uhh, about Jeff Bezos's cowboy hat …	https://news.yahoo.com/uhh-jeff-bezoss-cowboy-hat-192157515.html?fr=sycsrp_catchall	Washington Post				Left-Center	4.0	July 21, 2021	False	-6.237779
Alabama city leader won't quit after using racial slur	https://news.yahoo.com/alabama-city-leader-wont-quit-140839697.html?fr=sycsrp_catchall	Associated Press				Neutral	5.0	July 21, 2021	True	-3.389742
With 'Black Widow' ticket buying suddenly drying up, growing questions for Disney's Marvel about what did it in	https://news.yahoo.com/black-widow-ticket-buying-suddenly-144542555.html?fr=sycsrp_catchall	Washington Post				Left-Center	6.0	July 21, 2021	False	-1.29724
Unvaccinated Americans say COVID vaccines are riskier than the virus, even as Delta surges among them	https://news.yahoo.com/unvaccinated-people-face-growing-danger-120047254.html?fr=sycsrp_catchall	Yahoo News				Left-Center	7.0	July 21, 2021	False	-2.454537
Biden says even people who think he's 'Satan reincarnate' have to know something happened on Jan. 6	https://news.yahoo.com/biden-says-even-people-think-021319687.html?fr=sycsrp_catchall	The Week				Left	8.0	July 21, 2021	True	-4.19966
Yuen Long attack: Hong Kong court gives seven jail time	https://news.yahoo.com/yuen-long-attack-hong-kong-044539749.html?fr=sycsrp_catchall	BBC				Left-Center	9.0	July 21, 2021	True	-1.567147
At least 25 dead as rains deluge central China's Henan province	https://news.yahoo.com/heavy-rainfall-kills-12-central-220228956.html?fr=sycsrp_catchall	Reuters				Neutral	10.0	July 21, 2021	False	-0.149261
McConnell encourages people to get vaccinated, ignore anti-vax voices	https://news.yahoo.com/mcconnell-encourages-people-vaccinated-ignore-194041525.html	Yahoo News Video				Too many tries, Find Manually	11.0	July 21, 2021	False	5.412073
3 bodies found in China tunnel collapse, 11 still missing	https://news.yahoo.com/3-bodies-found-china-tunnel-075437303.html?fr=sycsrp_catchall	Associated Press				Neutral	12.0	July 21, 2021	False	
U.S., Germany strike Nord Stream 2 pipeline deal to push back on Russian 'aggression'	https://news.yahoo.com/germany-steps-against-russia-under-170235361.html	Reuters				Neutral	13.0	July 21, 2021	True	-1.400826
Former informant 'White Boy Rick' sues FBI for $100m	ERROR	BBC				Left-Center	14.0	July 21, 2021	True	ERROR
‘He could have at least given us a road.’ Residents in Haiti prepare for Moïse’s funeral	https://news.yahoo.com/could-least-given-us-road-235519398.html?fr=sycsrp_catchall	Miami Herald				Left-Center	15.0	July 21, 2021	True	0.410579
Room for 10,000: Inside China's largest detention center	https://news.yahoo.com/pandemic-rages-u-immigrants-detained-101214798.html?fr=sycsrp_catchall	Associated Press				Neutral	16.0	July 21, 2021	True	-2.278296
Venezuela's Maduro calls Vatican letter a 'compendium of hatred'	https://news.yahoo.com/venezuelas-maduro-calls-vatican-letter-011640765.html?fr=sycsrp_catchall	Reuters				Neutral	17.0	July 21, 2021	True	-1.807904
Flooding in central China turns streets to rivers, kills 12	https://news.yahoo.com/heavy-flooding-hits-central-china-133149764.html?fr=sycsrp_catchall	Associated Press				Neutral	18.0	July 21, 2021	False	-0.891704
China rejects WHO plan for study of COVID-19 origin	https://www.msn.com/en-ca/lifestyle/smart-living/the-latest-florida-county-orders-employees-to-be-vaccinated/ar-AAMFV79	Reuters				Neutral	19.0	July 21, 2021	True	ERROR
Hong Kong police arrest 5 trade union members for sedition	https://news.yahoo.com/hong-kong-police-arrest-5-041252280.html?fr=sycsrp_catchall	Associated Press				Neutral	20.0	July 21, 2021	True	-3.480335
Syria accuses Israel of carrying out strike, 2nd in a week	https://news.yahoo.com/syria-accuses-israel-carrying-strike-050722578.html?fr=sycsrp_catchall	Associated Press				Neutral	21.0	July 21, 2021	True	-3.350195
Why The Bath Mat Is Guaranteed to Spruce Up Your Space	https://news.yahoo.com/why-bath-mat-guaranteed-spruce-183500854.html	Architectural Digest				Left	22.0	July 21, 2021	True	-0.072842
From China to Germany, floods expose climate vulnerability	https://news.yahoo.com/china-germany-floods-expose-climate-050251516.html?fr=sycsrp_catchall	Reuters				Neutral	23.0	July 21, 2021	True	-2.498494
Shooting that injured driver on I-30 in Fort Worth was a case of road rage, police say	https://news.yahoo.com/shooting-injured-driver-30-fort-223137944.html?fr=sycsrp_catchall	Fort Worth Star-Telegram				Right-Center	24.0	July 21, 2021	True	-0.341918
Japan, UK to expand defense ties at sea, military technology	https://news.yahoo.com/japan-uk-expand-defense-ties-114050133.html?fr=sycsrp_catchall	Associated Press				Neutral	25.0	July 21, 2021	False	1.170582
Pennsylvania decertifies county's voting machines after 2020 audit	https://www.yahoo.com/entertainment/pennsylvania-decertifies-countys-voting-machines-205156699.html	Reuters				Neutral	26.0	July 21, 2021	True	-3.826352
Florida AG Moody tests positive for COVID days after being with DeSantis in Texas	https://news.yahoo.com/florida-ag-moody-tests-positive-010537205.html?fr=sycsrp_catchall	Miami Herald				Left-Center	27.0	July 21, 2021	True	0.561189
The group accused of plotting to kidnap Michigan Gov. Whitmer was riddled with FBI informants who took leading roles, according to BuzzFeed	https://news.yahoo.com/group-accused-plotting-kidnap-michigan-144724252.html?fr=sycsrp_catchall	INSIDER				Left-Center	28.0	July 21, 2021	True	-0.846518
Russia sends long-delayed module to space station	https://news.yahoo.com/russias-space-station-module-glitched-180527703.html?fr=sycsrp_catchall	BBC				Left-Center	29.0	July 21, 2021	True	-1.478979
Polish justice minister says Warsaw cannot comply with EU's court ruling	https://news.yahoo.com/polish-justice-minister-says-warsaw-185713836.html?fr=sycsrp_catchall	Reuters				Neutral	30.0	July 21, 2021	True	-0.123406
										ERROR
Florida, Missouri and Texas now account for 40% of new coronavirus cases in U.S.	https://news.yahoo.com/florida-missouri-and-texas-now-account-for-40-percent-of-new-us-coronavirus-cases-172032337.html	Yahoo News				Left-Center	1.0	July 22, 2021	True	-3.097811
Superbug' fungus spread in two cities, health officials say	https://news.yahoo.com//superbug-fungus-spread-two-cities-171511075.html	Associated Press				Neutral	2.0	July 22, 2021	True	-1.442117
Paul Gosar was a beloved dentist - now he's a MAGA congressman	https://news.yahoo.com//paul-gosar-beloved-dentist-now-144835793.html	Washington Post				Left-Center	3.0	July 22, 2021	False	-12.835581
Officials seize 15 giant land snails at Houston airport	https://news.yahoo.com//officials-seize-15-giant-land-233031405.html	CBS News				Left-Center	4.0	July 22, 2021	False	6.317814
Details on FBI Inquiry Into Kavanaugh Draw Fire From Democrats	https://news.yahoo.com//details-fbi-inquiry-kavanaugh-draw-181845650.html	The New York Times				Left-Center	5.0	July 22, 2021	True	-6.999512
Why Everyone Has the Worst Summer Cold Ever	https://news.yahoo.com//why-everyone-worst-summer-cold-183842931.html	The New York Times				Left-Center	6.0	July 22, 2021	True	-4.203808
Violence, protests overshadow Mass for slain Haitian leader	https://news.yahoo.com//violence-overshadows-memorial-mass-slain-170359156.html	Associated Press				Neutral	7.0	July 22, 2021	True	-2.49035
Biden hits Cuba with more sanctions over its crackdown on protesters	https://news.yahoo.com//biden-hits-cuba-more-sanctions-171329161.html	LA Times				Left-Center	8.0	July 22, 2021	True	-2.399263
911 call released in killing of mother, son in S. Carolina	https://news.yahoo.com//911-call-released-killing-mother-220356248.html	Associated Press				Neutral	9.0	July 22, 2021	True	-0.345521
Rep. Marjorie Taylor Greene holds a press conference after being reinstated on Twitter	https://news.yahoo.com//rep-marjorie-taylor-greene-holds-143005481.html	Yahoo News Video				Questionable Source	10.0	July 22, 2021	False	17.799572
Volunteers hunting for Mexico's 'disappeared' become targets	https://news.yahoo.com//volunteers-hunting-mexicos-disappeared-become-040214119.html	Associated Press				Neutral	11.0	July 22, 2021	True	-2.282855
Tarrant County voter fraud case ‘threatens the integrity’ of democracy, group says	https://news.yahoo.com//tarrant-county-voter-fraud-case-221758646.html	Fort Worth Star-Telegram				Right-Center	12.0	July 22, 2021	True	-2.128019
Typhoon to bring heavy rains to Taiwan, China over weekend	https://news.yahoo.com//typhoon-bring-heavy-rains-taiwan-064647100.html	Associated Press				Neutral	13.0	July 22, 2021	True	-1.295002
In venue fit for head of state, Japan PM seeks Pfizer doses	https://news.yahoo.com//venue-fit-head-state-japan-062036222.html	Associated Press				Neutral	14.0	July 22, 2021	True	0.375746
Republican politicians lost in Medicaid expansion standoff, and Missouri voters won	https://news.yahoo.com//republican-politicians-lost-medicaid-expansion-212625395.html	Kansas City Star				Left-Center	15.0	July 22, 2021	True	-15.173565
US diplomat worried about pandemic, food supply in N Korea	https://news.yahoo.com//us-diplomat-worried-pandemic-food-070203667.html	Associated Press				Neutral	16.0	July 22, 2021	False	0.47281
Brother of Miami condo victim heartbroken but not hopeless	https://news.yahoo.com//brother-miami-condo-victim-heartbroken-193558166.html	Associated Press				Neutral	17.0	July 22, 2021	True	-0.923495
Pelosi says 'deadly serious' Jan. 6 probe to go without GOP	https://news.yahoo.com//pelosi-says-jan-6-committee-165729105.html	Associated Press				Neutral	18.0	July 22, 2021	True	-2.891288
Why The Bath Mat Is Guaranteed to Spruce Up Your Space	https://news.yahoo.com//why-bath-mat-guaranteed-spruce-183500854.html	Architectural Digest				Left	19.0	July 22, 2021	False	-0.072842
Recent arrests reveal more about how cartel wives help run operations for Mexico's powerful Sinaloa cartel	https://news.yahoo.com//recent-arrests-reveal-more-cartel-223158658.html	Business Insider				Left-Center	20.0	July 22, 2021	True	-0.129814
GOP congressman says he wants to indict Jill Biden ‘for being so cruel to her husband’	https://news.yahoo.com//gop-congressman-says-wants-indict-203144153.html	The Independent				Left-Center	21.0	July 22, 2021	True	5.507795
Democrats outraged after the FBI said it got more than 4,500 tips about Brett Kavanaugh - and referred the 'relevant' ones to the Trump White House	https://news.yahoo.com//democrats-outraged-fbi-said-got-023607844.html	Business Insider				Left-Center	22.0	July 22, 2021	True	-6.1272
At 98 and facing cancer, Bob Dole reckons with legacy of Trump and ponders future of GOP	https://news.yahoo.com//98-facing-cancer-bob-dole-100314687.html	USA TODAY				Left-Center	23.0	July 22, 2021	True	-1.100881
A man who spent $30 million building a 3-mile wall between the US and Mexico is looking for someone to buy it	https://news.yahoo.com//man-spent-30-million-building-062315895.html	INSIDER				Left-Center	24.0	July 22, 2021	True	-7.438354
Ex-Army Ranger used his military training during Capitol riot, judge says	https://news.yahoo.com//ex-army-ranger-used-military-201332148.html	The Independent				Left-Center	25.0	July 22, 2021	True	0.08667
Three women attacked within the space of one hour in a New York City park	https://news.yahoo.com//three-women-attacked-within-space-135907954.html	The Independent				Left-Center	26.0	July 22, 2021	True	2.677361
The US launched strikes to destroy military equipment the Taliban captured from Afghan security forces	https://news.yahoo.com//us-launched-strikes-destroy-military-004629191.html	Business Insider				Left-Center	27.0	July 22, 2021	True	-0.647716
Georgia Rep. Hank Johnson arrested at voting rights demonstration, second House Democrat detained in a week	https://news.yahoo.com//georgia-rep-hank-johnson-arrested-205103607.html	USA TODAY				Left-Center	28.0	July 22, 2021	True	-1.788494
A man was lost in the Alaskan wilderness for weeks and fended off a grizzly bear nightly, until a coast guard helicopter spotted his 'SOS' by chance	https://news.yahoo.com//man-lost-alaskan-wilderness-weeks-013153165.html	INSIDER				Left-Center	29.0	July 22, 2021	True	-5.962803
As Tokyo Games open, can Olympic flame burn away the funk?	https://news.yahoo.com//tokyo-games-open-olympic-flame-061716673.html	Associated Press				Neutral	30.0	July 22, 2021	True	-0.281018
										ERROR
Exclusive-'QAnon Shaman' in plea negotiations after mental health diagnosis -lawyer	https://news.yahoo.com//exclusive-qanon-shaman-plea-negotiations-100653663.html	Reuters				Neutral	1.0	July 23, 2021	True	0.369674
A priest's phone location data outed his private life. It could happen to anyone.	https://www.yahoo.com/lifestyle/priests-phone-location-data-outed-223808426.html	Washington Post				Left-Center	2.0	July 23, 2021	False	-3.951654
Southern California cities rebel against new mask mandate, hinting at delta variant drama to come	https://news.yahoo.com//southern-california-cities-rebel-against-190121857.html	Washington Post				Left-Center	3.0	July 23, 2021	False	-3.366438
A Grizzly Bear Terrorized a Man for Days in Alaska. The Coast Guard Saw His SOS.	https://news.yahoo.com//grizzly-bear-terrorized-man-days-121007359.html	The New York Times				Left-Center	4.0	July 23, 2021	True	-7.543917
Cleveland Indians announce franchise's new name: the Guardians	https://sports.yahoo.com/cleveland-indians-announce-franchises-new-name-the-guardians-140148762.html	Yahoo Sports				Left-Center	5.0	July 23, 2021	True	0.649538
After Recent 'Heat Dome,' Washington Issues Warning Not to Eat Raw Shellfish	https://news.yahoo.com//recent-heat-dome-washington-issues-121302393.html	The New York Times				Left-Center	6.0	July 23, 2021	True	-6.129503
Exclusive: Jan. 6 select committee will include former CIA inspector general found to have retaliated against whistleblower	https://news.yahoo.com//exclusive-jan-6-select-committee-will-include-former-cia-inspector-general-found-to-have-retaliated-against-whistleblower-211238170.html	Yahoo News				Left-Center	7.0	July 23, 2021	True	-2.4041
China's Zhengzhou begins cleanup after deadly storms	https://news.yahoo.com//chinas-zhengzhou-begins-cleanup-storms-103635570.html	Associated Press				Neutral	8.0	July 23, 2021	False	
Venezuela says U.S. military plane violated its airspace	https://news.yahoo.com//venezuela-says-u-military-plane-231246725.html	Reuters				Neutral	9.0	July 23, 2021	True	-1.93716
Husky seen running after car when he’s abandoned is saved – and Texas man is arrested	https://news.yahoo.com//husky-seen-running-car-abandoned-001926080.html	Fort Worth Star-Telegram				Right-Center	10.0	July 23, 2021	True	2.610644
To reach a peace deal, Taliban say Afghan president must go	https://news.yahoo.com//reach-peace-deal-taliban-afghan-060957044.html	Associated Press				Neutral	11.0	July 23, 2021	False	0.588928
China's Sinovac evaluates vaccine plant in Chile	https://news.yahoo.com//chinas-sinovac-evaluates-vaccine-plant-195811879.html	Reuters				Neutral	12.0	July 23, 2021	True	0.357276
What the far-right's charge to remove Pelosi could mean for Kevin McCarthy	https://news.yahoo.com//far-rights-charge-remove-pelosi-170856416.html	The Week				Left	13.0	July 23, 2021	True	18.572428
Body of Arlington firefighter was found in bathroom window, Mexican authorities say	https://news.yahoo.com//body-arlington-firefighter-found-bathroom-234551961.html	Fort Worth Star-Telegram				Right-Center	14.0	July 23, 2021	True	2.421148
Biden stumps for McAuliffe in early test of political clout	https://news.yahoo.com//biden-stumps-mcauliffe-early-test-201844206.html	Associated Press				Neutral	15.0	July 23, 2021	True	-0.372049
SpaceX lands NASA launch contract for mission to Jupiter's moon Europa	https://news.yahoo.com//spacex-lands-nasa-launch-contract-030631164.html	Reuters				Neutral	16.0	July 23, 2021	True	0.03276
A 'significant and far-reaching' heat wave is coming to the U.S. next week	https://news.yahoo.com//significant-far-reaching-heat-wave-153622707.html	The Week				Left	17.0	July 23, 2021	True	-8.125511
SC police got phone data of Josephson’s alleged ‘fake Uber’ killer. Here’s what they found	https://news.yahoo.com//sc-police-got-phone-data-161412016.html	The State				Left-Center	18.0	July 23, 2021	True	0.800567
Search for bodies concludes at Surfside condo collapse site	https://news.yahoo.com//search-bodies-concludes-surfside-condo-214845328.html	Yahoo News Video				Questionable Source	19.0	July 23, 2021	True	-1.027019
Poland a step closer to adopting controversial property law	https://news.yahoo.com//poland-step-closer-adopting-controversial-203852602.html	Associated Press				Neutral	20.0	July 23, 2021	True	-1.700871
Afghan Air Force hurt by inoperable aircraft - Afghan lawmakers	https://news.yahoo.com//afghan-air-force-hurt-inoperable-181701268.html	Reuters				Neutral	21.0	July 23, 2021	True	1.118887
Bones found near area where missing British hiker Esther Dingley disappeared	https://news.yahoo.com//bones-found-near-area-where-175052488.html	The Telegraph				Right	22.0	July 23, 2021	True	-1.144662
Vietnam locks down capital Hanoi for 15 days as cases rise	https://news.yahoo.com//vietnam-locks-down-capital-hanoi-032426813.html	Associated Press				Neutral	23.0	July 23, 2021	True	-0.134413
China imposes sanctions on US officials	https://news.yahoo.com//china-imposes-sanctions-us-officials-225503142.html	BBC				Left-Center	24.0	July 23, 2021	True	-3.953424
Tokyo 2020 'axed opening ceremony musician for being black'	https://news.yahoo.com//tokyo-2020-axed-opening-ceremony-205357039.html	The Telegraph				Right	25.0	July 23, 2021	True	-1.169694
Are COVID symptoms different with the delta variant? Here’s what experts say	https://news.yahoo.com//covid-symptoms-different-delta-variant-185023861.html	Miami Herald				Left-Center	26.0	July 23, 2021	True	1.827701
Trump's sway tested in race for open mid-Ohio US House seat	https://news.yahoo.com//trumps-sway-tested-race-open-114336014.html	Associated Press				Neutral	27.0	July 23, 2021	True	-1.311566
CDC says ‘superbug’ fungus has spread in Washington, D.C., and Dallas	https://news.yahoo.com//cdc-says-superbug-fungus-spread-202812229.html	Yahoo News Video				Questionable Source	28.0	July 23, 2021	False	-0.559251
