Dutch teen on space flight told Bezos he had never ordered from Amazon	https://news.yahoo.com//dutch-teen-space-flight-told-163423384.html	Reuters				Neutral	29.0	July 23, 2021	True	-0.185692
Slovenia PM accuses EU official of lying over rule of law	https://news.yahoo.com//slovenia-pm-accuses-eu-official-154447938.html	Associated Press				Neutral	30.0	July 23, 2021	True	-1.013784
										ERROR
Florida tops the nation in new COVID cases. As they spike in its rural Big Bend, many still fear the vaccine more.	https://news.yahoo.com//florida-tops-nation-covid-cases-151309966.html	USA TODAY				Left-Center	1.0	July 24, 2021	True	-1.009701
Gaetz case takes bizarre tabloid turn	https://news.yahoo.com//gaetz-case-takes-bizarre-tabloid-170244424.html	Politico				Left-Center	2.0	July 24, 2021	False	0.793103
Imprisoned 'Dating Game Killer' Alcala dies in California	https://news.yahoo.com//imprisoned-dating-game-killer-alcala-192232768.html	Associated Press				Neutral	3.0	July 24, 2021	True	0.328847
He refused to give up his coveted Twitter handle. Then he was 'swatted' and died of a heart attack.	https://news.yahoo.com//refused-coveted-twitter-handle-then-193345633.html	Washington Post				Left-Center	4.0	July 24, 2021	True	-3.884276
AP-NORC poll: Most unvaccinated Americans don't want shots	https://news.yahoo.com//ap-norc-poll-most-unvaccinated-144516547.html	Associated Press				Neutral	5.0	July 24, 2021	False	0.089668
Patience has worn thin': Frustration mounts over vaccine holdouts	https://news.yahoo.com//patience-worn-thin-frustration-mounts-003258894.html	Washington Post				Left-Center	6.0	July 24, 2021	False	-5.010376
Typhoon In-Fa sweeps towards China after flooding chaos	https://news.yahoo.com//typhoon-fa-sweeps-towards-china-133926108.html	BBC				Left-Center	7.0	July 24, 2021	True	-2.315494
Russia excludes senior Communist candidate from parliamentary vote	https://news.yahoo.com//russia-excludes-senior-communist-candidate-125812651.html	Reuters				Neutral	8.0	July 24, 2021	True	-1.501063
Sale of semiconductor factory to Chinese-owned firm presents bigger UK risk than Huawei	https://news.yahoo.com//sale-semiconductor-business-chinese-firm-150647558.html	The Telegraph				Right	9.0	July 24, 2021	True	-0.78287
LA man who mocked Covid-19 vaccines dies of virus	https://news.yahoo.com//la-man-mocked-covid-19-223242462.html	BBC				Left-Center	10.0	July 24, 2021	True	-1.322183
Vietnam reports record 7,968 coronavirus cases on Saturday	https://news.yahoo.com//vietnam-reports-record-7-968-124501940.html	Reuters				Neutral	11.0	July 24, 2021	True	-0.374979
A man found with guns and ammunition in his Chicago hotel room told police it was a 'mistake' and he 'didn't mean to startle anyone'	https://news.yahoo.com//man-found-guns-ammunition-chicago-015851455.html	INSIDER				Left-Center	12.0	July 24, 2021	True	-2.426555
Afghanistan curfew imposed as Taliban militants advance	https://news.yahoo.com//afghanistan-curfew-imposed-taliban-militants-151207065.html	BBC				Left-Center	13.0	July 24, 2021	True	1.462905
U.S. hits one of two targets in missile defense test - agency	https://news.yahoo.com//u-hits-one-two-targets-202037958.html	Reuters				Neutral	14.0	July 24, 2021	True	1.344018
Germany toughens rules for travel from Spain, Netherlands	https://news.yahoo.com//germany-toughens-rules-travel-spain-143027723.html	Associated Press				Neutral	15.0	July 24, 2021	False	-0.645576
Report: 'QAnon Shaman' in plea negotiations after mental illness diagnosis	https://news.yahoo.com//report-qanon-shaman-plea-negotiations-125125315.html	Yahoo News Video				Questionable Source	16.0	July 24, 2021	False	1.146573
Arlington firefighter accidentally asphyxiated in Cancun window, authorities conclude	https://news.yahoo.com//arlington-firefighter-accidentally-asphyxiated-cancun-190258328.html	Fort Worth Star-Telegram				Right-Center	17.0	July 24, 2021	True	2.104931
China confirms ban on for-profit tutoring in core school subjects - Xinhua	https://news.yahoo.com//china-confirms-profit-tutoring-core-112045849.html	Reuters				Neutral	18.0	July 24, 2021	True	-0.878945
Why it may be a 'grave mistake' for FDA to wait much longer for full COVID-19 vaccine approval	https://news.yahoo.com//why-may-grave-mistake-fda-185000105.html	The Week				Left	19.0	July 24, 2021	True	-7.300928
Fauci: 'There's no way' the coronavirus was made with U.S. research funds. Here's why	https://news.yahoo.com//fauci-theres-no-way-coronavirus-120033699.html	LA Times				Left-Center	20.0	July 24, 2021	True	-9.992004
Army Ranger Savagely Killed Female Security Guard in Drunken Rampage: Police	https://news.yahoo.com//army-ranger-savagely-killed-female-172255483.html	The Daily Beast				Left	21.0	July 24, 2021	True	1.385381
At the recent CPAC, attendees celebrated the failure of Biden's goal to vaccinate 70% of adults. Now top Republicans have U-turned, urging people to get their jab.	https://news.yahoo.com//recent-cpac-attendees-celebrated-failure-155302579.html	Business Insider				Left-Center	22.0	July 24, 2021	True	-5.473152
A United Airlines flight was evacuated after a teenager AirDropped a photo of an airsoft gun to other passengers, report says	https://news.yahoo.com//united-airlines-flight-evacuated-teenager-131229565.html	Business Insider				Left-Center	23.0	July 24, 2021	True	-0.961419
‘Avenge Her Murder’: The Grisly Killing of an Ex-Diplomat’s Daughter Ignites a Wave of Fury Worldwide	https://news.yahoo.com//avenge-her-murder-grisly-killing-235108660.html	The Daily Beast				Left	24.0	July 24, 2021	True	-8.94253
Powerhouse US swim team shines with 6 medals, 1st US gold	https://news.yahoo.com//kalisz-wins-first-us-medal-014806234.html	Associated Press				Neutral	25.0	July 24, 2021	True	-0.656563
First images of Derek Chauvin in prison are released	https://news.yahoo.com//first-images-derek-chauvin-prison-142103579.html	The Independent				Left-Center	26.0	July 24, 2021	True	-8.095274
California family say they were treated like criminals on a Southwest flight because their toddler wouldn't keep his mask on	https://news.yahoo.com//california-family-were-treated-criminals-131004121.html	Business Insider				Left-Center	27.0	July 24, 2021	True	2.822335
Heat wave to cover huge swath of US in coming days, bringing high temperatures to millions	https://news.yahoo.com//heat-wave-cover-huge-swath-002251140.html	USA TODAY				Left-Center	28.0	July 24, 2021	True	-0.037066
Biden set to nominate Caroline Kennedy as US ambassador to Australia: report	https://news.yahoo.com//biden-set-nominate-caroline-kennedy-182229535.html	Business Insider				Left-Center	29.0	July 24, 2021	True	-0.974685
R. Kelly sexually abused teenage boy he met in McDonald's and bribed officials for information about his legal case, prosecutors allege	https://news.yahoo.com//r-kelly-sexually-abused-teenage-145812082.html	INSIDER				Left-Center	30.0	July 24, 2021	True	-5.679163
										ERROR
Russia sets stage for enticing gymnastics final by outscoring Simone Biles, Team USA in qualifying	https://sports.yahoo.com/simone-biles-team-usa-finish-second-to-russia-in-womens-gymnastics-in-qualifying-090723115.html	Yahoo Sports				Left-Center	1.0	July 25, 2021	True	-1.660393
Burned by Hot Housing Market, Some Buyers Back Off	https://news.yahoo.com//burned-hot-housing-market-buyers-140916237.html	The New York Times				Left-Center	2.0	July 25, 2021	True	-6.323924
Americans' optimism about country's direction over next year drops nearly 20 points since May: POLL	https://www.yahoo.com/gma/americans-optimism-countrys-direction-over-110100639.html	Good Morning America				Left-Center	3.0	July 25, 2021	True	3.114583
The Most Influential Spreader of Coronavirus Misinformation Online	https://news.yahoo.com//most-influential-spreader-coronavirus-misinformation-141227038.html	The New York Times				Left-Center	4.0	July 25, 2021	True	-3.651881
One nation under fire: A week's glance at gun violence ripping across America	https://www.yahoo.com/gma/one-nation-under-fire-weeks-132236894.html	Good Morning America				Left-Center	5.0	July 25, 2021	True	-2.137584
Buy My House, But I'm Taking the Toilet	https://news.yahoo.com//buy-house-im-taking-toilet-141636584.html	The New York Times				Left-Center	6.0	July 25, 2021	True	-5.954223
A Mexican state suffers bloody fallout of cartel rivalry	https://news.yahoo.com//mexican-state-suffers-bloody-fallout-040001546.html	Associated Press				Neutral	7.0	July 25, 2021	True	-0.484063
Afghanistan curfew imposed as Taliban militants advance	https://news.yahoo.com//afghanistan-curfew-imposed-taliban-militants-151207065.html	BBC				Left-Center	8.0	July 25, 2021	True	1.462905
New Zealand to accept alleged Islamic State militant, 2 kids	https://news.yahoo.com//zealand-accept-alleged-islamic-state-034208188.html	Associated Press				Neutral	9.0	July 25, 2021	True	-2.302637
With eye on China, Pentagon chief heads to Southeast Asia	https://news.yahoo.com//eye-china-pentagon-chief-heads-041447021.html	Reuters				Neutral	10.0	July 25, 2021	True	0.417629
India landslide: Nine tourists killed as boulders fall from hilltop	https://news.yahoo.com//india-landslide-nine-tourists-killed-150059149.html	BBC				Left-Center	11.0	July 25, 2021	True	-4.493591
Nigerian outrage at brazen bandit attacks	https://news.yahoo.com//nigerian-outrage-brazen-bandit-attacks-231009617.html	BBC				Left-Center	12.0	July 25, 2021	True	-2.203414
Pandemic leaves Indians mired in massive medical debts	https://news.yahoo.com//pandemic-leaves-indians-mired-massive-043601230.html	Associated Press				Neutral	13.0	July 25, 2021	True	-2.36108
Migrant workers stranded in China's flooded cities	https://news.yahoo.com//migrant-workers-stranded-chinas-flooded-082529147.html	Reuters Videos				Left	14.0	July 25, 2021	False	-0.698458
Sarah Huckabee Sanders says Biden, Harris should give Trump credit to increase vaccination rate	https://news.yahoo.com//sarah-huckabee-sanders-says-biden-150211902.html	The Week				Left	15.0	July 25, 2021	True	-7.526976
Australia sees COVID-19 cases climb, police warn against protest repeat	https://news.yahoo.com//australias-victoria-eyes-covid-19-234527626.html	Reuters				Neutral	16.0	July 25, 2021	True	-0.970893
Covid: Fauci says US heading in wrong direction as cases rise	https://news.yahoo.com//covid-fauci-says-us-heading-195658123.html	BBC				Left-Center	17.0	July 25, 2021	True	-0.779537
U.S. House Speaker Pelosi names Republican Kinzinger to Jan. 6 panel	https://news.yahoo.com//u-house-speaker-pelosi-may-151837284.html	Reuters				Neutral	18.0	July 25, 2021	True	-1.573949
Lebanese Sunni tycoon Najib Mikati poised to be designated PM	https://news.yahoo.com//lebanese-sunni-muslim-leaders-endorse-165434736.html	Reuters				Neutral	19.0	July 25, 2021	True	
Decades ago, Fidel Castro promised all a better way of life: He lied to Cubans like my parents | Opinion	https://news.yahoo.com//decades-ago-fidel-castro-promised-193132325.html	Miami Herald				Left-Center	20.0	July 25, 2021	True	8.381739
Police respond to viral video showing officer appearing to toss a baggie into man’s car	https://news.yahoo.com//police-respond-viral-video-showing-192931364.html	The Independent				Left-Center	21.0	July 25, 2021	True	-3.404202
Prashant Kishor: How to win elections and influence people	https://news.yahoo.com//prashant-kishor-win-elections-influence-230248117.html	BBC				Left-Center	22.0	July 25, 2021	True	0.419679
Philip Morris International CEO said cigarettes should be banned and that the company will stop selling Marlboros in the UK within a decade	https://news.yahoo.com//philip-morris-international-ceo-said-014718006.html	Business Insider				Left-Center	23.0	July 25, 2021	True	-3.12583
Malaysia will not extend state of emergency, says law minister	https://news.yahoo.com//malaysia-not-extend-state-emergency-042039166.html	Reuters				Neutral	24.0	July 25, 2021	True	-1.031923
Like a hammer hitting us in the head': Homes ablaze in California as Western wildfires rage	https://news.yahoo.com//rugged-terrain-hot-dry-conditions-145638183.html	USA TODAY				Left-Center	25.0	July 25, 2021	True	-2.556816
Will Foxconn Billionaire Terry Gou’s COVID-19 Vaccine Deal Bring Taiwan Closer to China?	https://news.yahoo.com//foxconn-billionaire-terry-gou-covid-050456452.html	Time				Left-Center	26.0	July 25, 2021	True	-2.690344
The 'QAnon Shaman' is in plea negotiations after being diagnosed with mental illnesses, including schizophrenia and bipolar disorder, report says	https://news.yahoo.com//qanon-shaman-plea-negotiations-being-003139848.html	Business Insider				Left-Center	27.0	July 25, 2021	True	-0.958388
The Disturbing Story Behind Tucker Carlson’s Favorite Black Cop	https://news.yahoo.com//disturbing-story-behind-tucker-carlson-002512170.html	The Daily Beast				Left	28.0	July 25, 2021	True	-11.04786
How Russia is skirting ban on nationality markers at Olympics	https://news.yahoo.com//russia-skirting-ban-nationality-markers-145328540.html	The Week				Left	29.0	July 25, 2021	False	-1.831472
Fact check: Pfizer, Moderna vaccines don't pose 'any obvious safety signals' in pregnancy, study found	https://news.yahoo.com//fact-check-pfizer-moderna-vaccines-192218777.html	USA TODAY				Left-Center	30.0	July 25, 2021	True	-0.025503
										ERROR
Rookie Bankers Sour on Wall Street's Pitch of Big Pay and Long Hours	https://news.yahoo.com//rookie-bankers-sour-wall-streets-120304359.html	The New York Times				Left-Center	1.0	July 26, 2021	True	-4.505459
Making sense of conservatives’ sudden vaccine endorsements	https://news.yahoo.com//making-sense-of-conservatives-sudden-vaccine-endorsements-150144023.html	Yahoo News 360					2.0	July 26, 2021	True	-3.334959
Salmon for Norway, Chernobyl for Ukraine: Korean broadcaster apologizes for 'inexcusable' Olympics gaffe	https://news.yahoo.com//salmon-norway-chernobyl-ukraine-korean-175203385.html	Washington Post				Left-Center	3.0	July 26, 2021	True	-3.318648
A Common Heart Problem That's Easy to Miss	https://news.yahoo.com//common-heart-problem-thats-easy-121634758.html	The New York Times				Left-Center	4.0	July 26, 2021	True	-5.226686
Former Sen. Barbara Boxer assaulted and robbed	https://www.yahoo.com/gma/former-sen-barbara-boxer-assaulted-231000046.html	ABC News				Left-Center	5.0	July 26, 2021	True	1.447209
As Delta variant spreads, so do vaccine mandates	https://news.yahoo.com//as-delta-variant-spreads-so-do-vaccine-mandates-203940945.html	Yahoo News				Left-Center	6.0	July 26, 2021	True	-0.060629
5 dead, including a sheriff's deputy, in the wake of California standoff	https://news.yahoo.com//5-dead-including-sheriffs-deputy-185030898.html	NBC News				Left-Center	7.0	July 26, 2021	True	0.483127
Lightfoot says she would 'absolutely' exclude white journalists from interviews again	https://news.yahoo.com//lightfoot-says-she-absolutely-exclude-185800767.html	Washington Examiner				Right	8.0	July 26, 2021	True	-0.079048
At least 8 killed in 22-car pileup in Utah during sandstorm	https://news.yahoo.com//least-6-killed-20-car-034237225.html	Associated Press				Neutral	9.0	July 26, 2021	False	0.117846
House rejects GOP effort to seat McCarthy's choices for Jan. 6 select panel	https://news.yahoo.com//house-rejects-gop-effort-seat-235505305.html	Axios				Left-Center	10.0	July 26, 2021	True	-2.593241
Gunman kills 1, injures 3 before he is stoned to death in Fort Worth, police say	https://news.yahoo.com//gunman-kills-1-injuries-3-112345345.html	Fort Worth Star-Telegram				Right-Center	11.0	July 26, 2021	True	0.435535
California will require state and healthcare workers to show proof of vaccination or regular negative tests	https://news.yahoo.com//california-require-state-healthcare-workers-185300615.html	Washington Examiner				Right	12.0	July 26, 2021	True	-0.045526
Extreme drought pushes 2 major U.S. lakes to historic lows	https://news.yahoo.com//extreme-drought-pushes-2-major-051134366.html	Axios				Left-Center	13.0	July 26, 2021	True	-7.003574
Family: Last victim ID'd in Florida condo building collapse	https://news.yahoo.com//brother-last-victim-idd-florida-185004022.html	Associated Press				Neutral	14.0	July 26, 2021	True	-1.310165
McCarthy makes last-ditch effort to seat GOP picks on Jan. 6 committee	https://news.yahoo.com//mccarthy-makes-last-ditch-effort-232800215.html	Washington Examiner				Right	15.0	July 26, 2021	True	5.422394
Dad sees ex-wife and her boyfriend at son’s soccer game and kills them, Texas cops say	https://news.yahoo.com//dad-sees-ex-wife-her-231644498.html	Fort Worth Star-Telegram				Right-Center	16.0	July 26, 2021	True	
Family: Last victim identified in Florida condo building collapse	https://news.yahoo.com//family-last-victim-identified-florida-221431818.html	Yahoo News Video				Questionable Source	17.0	July 26, 2021	True	-0.991183
Trump endorses Paxton over Bush in Texas attorney general race	https://news.yahoo.com//trump-endorses-paxton-over-bush-014148543.html	NBC News				Left-Center	18.0	July 26, 2021	True	-3.14587
Search for missing Pennsylvania woman intensifies two weeks after she disappeared after leaving friend's house in Philadelphia	https://news.yahoo.com//search-missing-pennsylvania-woman-intensifies-235022508.html	NBC News				Left-Center	19.0	July 26, 2021	True	3.44519
This Idaho hot springs was shut down 5 years ago. It won’t reopen for at least 5 more	https://news.yahoo.com//idaho-hot-springs-shut-down-214129490.html	Idaho Statesman				Neutral	20.0	July 26, 2021	True	-1.070941
Former US Sen. Barbara Boxer assaulted, robbed in California	https://news.yahoo.com//former-us-sen-barbara-boxer-234427141.html	Associated Press				Neutral	21.0	July 26, 2021	True	0.39629
"Thousands evacuated as ""erratic"" wildfires rage in California"	https://news.yahoo.com//thousands-evacuated-erratic-wildfires-rage-121355608.html	CBS News				Left-Center	22.0	July 26, 2021	True	
NC doctor sought 2 hours of sex a month with nurse in blackmail plot, lawsuit says	https://news.yahoo.com//nc-doctor-sought-2-hours-171835508.html	Charlotte Observer				Left-Center	23.0	July 26, 2021	True	-3.834933
Scientists discover a massive field of nuclear silos in China, signaling a significant nuclear expansion in the country	https://news.yahoo.com//scientists-discover-massive-field-nuclear-044323563.html	INSIDER				Left-Center	24.0	July 26, 2021	True	-3.991871
White House press secretary Jen Psaki says Biden doesn't want to 'fight' Fox News after Trump 'completely destroyed trust in media' and institutions	https://news.yahoo.com//white-house-press-sec-jen-145325598.html	Business Insider				Left-Center	25.0	July 26, 2021	True	-3.798049
Australian sports writer doesn't think Naomi Osaka is Japanese enough to light Olympic torch	https://news.yahoo.com//australian-sports-writer-doesnt-think-183143436.html	NextShark					26.0	July 26, 2021	True	1.170236
McCarthy calls Reps. Cheney and Kinzinger “Pelosi Republicans” after they joined the Jan. 6 Select Committee	https://news.yahoo.com//mccarthy-calls-reps-cheney-kinzinger-182317470.html	Yahoo News Video				Questionable Source	27.0	July 26, 2021	True	6.614015
Matt Gaetz’s Future Sister-in-Law Says He’s a Gaslighting ‘Creep’	https://news.yahoo.com//matt-gaetz-future-sister-law-015752535.html	The Daily Beast				Left	28.0	July 26, 2021	True	-6.927786
A Tennessee pastor has threatened to kick mask-wearing churchgoers from his congregation	https://news.yahoo.com//tennessee-pastor-threatened-kick-mask-032548354.html	INSIDER				Left-Center	29.0	July 26, 2021	True	-2.136908
All About the $130 Million Mega-Yacht Where Jennifer Lopez Reportedly Celebrated Her Birthday With Ben Affleck	https://news.yahoo.com//130-million-mega-yacht-where-210240441.html	Architectural Digest				Left	30.0	July 26, 2021	True	0.144638
										ERROR
HIPAA and COVID vaccines: What Rep. Marjorie Taylor Greene and Cowboys quarterback Dak Prescott get wrong	https://news.yahoo.com//hipaa-and-covid-vaccines-what-rep-marjorie-taylor-green-and-cowboys-quarterback-dak-prescott-get-wrong-195447388.html	Yahoo News				LEFT-CENTER BIAS	1.0	July 27, 2021	True	-8.15136
Europeans increasingly frustrated as White House maintains Trump-era covid travel restrictions	https://news.yahoo.com//europeans-increasingly-frustrated-white-house-131423155.html	Washington Post				LEFT-CENTER BIAS	2.0	July 27, 2021	True	-3.578743
Man gets life for killing woman who mistook his car for Uber	https://news.yahoo.com//prosecutors-south-carolina-man-killed-154331331.html	Associated Press				LEAST BIASED	3.0	July 27, 2021	True	-0.003943
Evangelical pastor demands churchgoers ditch their masks: 'Don't believe this delta variant nonsense'	https://news.yahoo.com//evangelical-pastor-demands-churchgoers-ditch-101435205.html	Washington Post				LEFT-CENTER BIAS	4.0	July 27, 2021	True	-6.073839
Here's what could happen to the Trump Organization now	https://news.yahoo.com//heres-could-happen-trump-organization-163610985.html	Washington Post				LEFT-CENTER BIAS	5.0	July 27, 2021	True	-12.092926
A San Diego Zoo snow leopard was coughing. A test showed he had covid-19.	https://news.yahoo.com//san-diego-zoo-snow-leopard-214639467.html	Washington Post				LEFT-CENTER BIAS	6.0	July 27, 2021	False	-2.430401
Rep. Stephanie Murphy says officers at the Capitol on Jan. 6 saved her life: 'Your actions had a profound impact on me'	https://news.yahoo.com//rep-stephanie-murphy-says-officers-at-the-capitol-on-jan-6-saved-her-life-your-actions-had-a-profound-impact-on-me-174255244.html	Yahoo News				LEFT-CENTER BIAS	7.0	July 27, 2021	True	-0.505857
Patients died after operations to remove objects left inside them were cancelled due to Covid	https://news.yahoo.com//patients-died-operations-remove-objects-151737182.html	The Telegraph				RIGHT BIAS	8.0	July 27, 2021	True	-1.953783
Some in GOP move to kick out Cheney and Kinzinger and make shunning official	https://news.yahoo.com//gop-move-kick-cheney-kinzinger-214300698.html	Washington Examiner				RIGHT BIAS	9.0	July 27, 2021	True	10.888067
Border Patrol Released 50,000 Migrants into U.S. without Court Date: Report	https://news.yahoo.com//border-patrol-released-50-000-193351843.html	National Review				RIGHT BIAS	10.0	July 27, 2021	True	2.896925
Placemats Make Every Day a Party	https://news.yahoo.com//placemats-every-day-party-140000466.html	Architectural Digest				LEFT BIAS	11.0	July 27, 2021	True	-0.130622
Vaccinated people infected with delta variant might be contagious, CDC says in justifying mask guidance	https://news.yahoo.com//vaccinated-people-infected-delta-variant-205200402.html	Washington Examiner				RIGHT BIAS	12.0	July 27, 2021	True	1.108639
George P. Bush learns the GOP's Trump lesson the hard way	https://news.yahoo.com//george-p-bush-learns-gops-171943529.html	The Week				LEFT BIAS	13.0	July 27, 2021	True	-20.718407
Four women were killed in a crash in the Keys. Their families deserve $12M, a jury says	https://news.yahoo.com//four-women-were-killed-crash-213838988.html	Miami Herald				LEFT-CENTER BIAS	14.0	July 27, 2021	True	
Kinzinger Defends Lack of Probe into BLM Riots During January 6 Committee Hearing	https://news.yahoo.com//kinzinger-defends-lack-probe-blm-181950692.html	National Review				RIGHT BIAS	15.0	July 27, 2021	True	18.812506
Ten hours of sleep a night and a cheat day every week – how J-Lo looks this good at 52	https://news.yahoo.com//ten-hours-sleep-night-cheat-110858080.html	The Telegraph				RIGHT BIAS	16.0	July 27, 2021	True	-4.09252
Arizona audit: Republican liaison tells Insider the audit process has been 'very odd' and that he may resign	https://news.yahoo.com//arizona-audit-republican-liaison-tells-221212790.html	Business Insider				LEFT-CENTER BIAS	17.0	July 27, 2021	True	0.530164
Biden should extend student loan payment pause and cancel $50,000 for borrowers: Schumer	https://news.yahoo.com//biden-extend-student-loan-payment-164728344.html	USA TODAY Opinion					18.0	July 27, 2021	True	-4.775711
Goddess of weightlifting' wins first gold medal for Taiwan in Tokyo, sets three Olympic records	https://news.yahoo.com//goddess-weightlifting-wins-first-gold-000557878.html	NextShark					19.0	July 27, 2021	True	1.399388
Jan. 6 rioters told Capitol Police sergeant ‘You’re not even an American’	https://news.yahoo.com//jan-6-rioters-told-capitol-180602266.html	Yahoo News Video				QUESTIONABLE SOURCE	20.0	July 27, 2021	True	0.552424
Workmen digging a well in a man's backyard discovered a $100 million windfall - a cluster of 2.5 million sapphire carats	https://news.yahoo.com//workmen-digging-well-mans-backyard-030446643.html	INSIDER				LEFT-CENTER BIAS	21.0	July 27, 2021	True	-1.566077
The US military is changing the way it fights after it 'failed miserably' in a war game against an aggressive adversary who knew its playbook	https://news.yahoo.com//us-military-changing-way-fights-174619469.html	Business Insider				LEFT-CENTER BIAS	22.0	July 27, 2021	True	2.186513
Russia's risky flybys may be attempts at 'baiting us into shooting first,' top US admiral says	https://news.yahoo.com//russias-risky-flybys-may-attempts-214923845.html	Business Insider				LEFT-CENTER BIAS	23.0	July 27, 2021	True	-0.360951
DaBaby doubles down on homophobic rant with more offensive comments	https://news.yahoo.com//dababy-doubles-down-homophobic-rant-141029280.html	TheGrio				LEFT BIAS	24.0	July 27, 2021	True	-0.825124
Legendary competitive eater Joey Chestnut reveals what happened to his body after he ate 76 hot dogs and buns in 10 minutes	https://news.yahoo.com//legendary-competitive-eater-joey-chestnut-214602684.html	INSIDER				LEFT-CENTER BIAS	25.0	July 27, 2021	True	-1.641565
Florida Gov. Ron DeSantis Meets with Wild L.A. Vaccine Skeptic Despite Flooded Hospitals	https://news.yahoo.com//florida-gov-ron-desantis-meets-194918593.html	The Daily Beast				LEFT BIAS	26.0	July 27, 2021	True	-10.324296
